{"execution_contract":{"backend":"cpu","backend_policy_digest":"ee5ed659cfd1a5cc9b87ec538f0c201b16da48e94c4a710fb60d3aa4684e6148","deterministic_mode":"stable-v1","dtype":"complex128","eps":1e-12,"execution_nufft_policy":"auto","interval_artifact_policy":"required_transport","pre_sum_mode":"off","reducer_strategy":"attempt-commit","requested_nufft_policy":"auto","scheduler_kind":"dask","source_structure_digest":"3edb0f3498250745a855d580c0bc70fd3bd4960c5e740034b4ceb805e16f4308","thread_count":1},"execution_digest":"cfe984c9afc8291ae68d95afb7c7a8ed2fe877470c3ddd5f758c6e283b358280","run_digest":"9d26d22f686f8f23f572f4e04cbed242","schema":"mosaic.run_manifest","schema_version":1,"scientific_digest":"03f2f2aeeb2f0dd48141d981d2c693a1db9b0e687d2b554587316cd1bfb2a2f8"}
