{"execution_contract":{"backend":"cpu","backend_policy_digest":"ee5ed659cfd1a5cc9b87ec538f0c201b16da48e94c4a710fb60d3aa4684e6148","deterministic_mode":"stable-v1","dtype":"complex128","eps":1e-12,"execution_nufft_policy":"auto","interval_artifact_policy":"required_transport","pre_sum_mode":"off","reducer_strategy":"attempt-commit","requested_nufft_policy":"auto","scheduler_kind":"dask","source_structure_digest":"3edb0f3498250745a855d580c0bc70fd3bd4960c5e740034b4ceb805e16f4308","thread_count":1},"execution_digest":"641f005594a1ec7a3173b30e5e0efb5b57b2d8deffcb80ea84212e2cb05c28de","run_digest":"f673ba4e0bb4e169e95f1363c5f46f3c","schema":"mosaic.run_manifest","schema_version":1,"scientific_digest":"4188cbe83029d48a930ab2913cd970c3bbc2ea860ade8b291bbffe274d11f13e"}
