{"execution_contract":{"backend":"cpu","backend_policy_digest":"ee5ed659cfd1a5cc9b87ec538f0c201b16da48e94c4a710fb60d3aa4684e6148","deterministic_mode":"stable-v1","dtype":"complex128","eps":1e-12,"execution_nufft_policy":"auto","interval_artifact_policy":"required_transport","pre_sum_mode":"off","reducer_strategy":"attempt-commit","requested_nufft_policy":"auto","scheduler_kind":"dask","source_structure_digest":"3edb0f3498250745a855d580c0bc70fd3bd4960c5e740034b4ceb805e16f4308","thread_count":1},"execution_digest":"53aecbc1dbb93071b2156fd2036f5b3bf36ab5839dcd371ac8f685a39a24adf9","run_digest":"e19bfd6556fe6b98376d35ffb02b476d","schema":"mosaic.run_manifest","schema_version":1,"scientific_digest":"0661450e67599199d1c89ced69bff248ddae78d46101c5100e5b5ab534f704ae"}
