{"execution_contract":{"backend":"cpu","backend_policy_digest":"ee5ed659cfd1a5cc9b87ec538f0c201b16da48e94c4a710fb60d3aa4684e6148","deterministic_mode":"stable-v1","dtype":"complex128","eps":1e-12,"execution_nufft_policy":"auto","interval_artifact_policy":"required_transport","pre_sum_mode":"off","reducer_strategy":"attempt-commit","requested_nufft_policy":"auto","scheduler_kind":"dask","source_structure_digest":"3edb0f3498250745a855d580c0bc70fd3bd4960c5e740034b4ceb805e16f4308","thread_count":1},"execution_digest":"b76c7e1d08e0ff488a211a757ddb826c25761a9825f5a72123b8849249a3d7b6","run_digest":"dbfb65ebc094b5b5624ef040276fc114","schema":"mosaic.run_manifest","schema_version":1,"scientific_digest":"d8c17474561da1c36c769939a62ce7f6084f74706a988d64148fc073240ce5c3"}
