{"execution_contract":{"backend":"cpu","backend_policy_digest":"ee5ed659cfd1a5cc9b87ec538f0c201b16da48e94c4a710fb60d3aa4684e6148","deterministic_mode":"stable-v1","dtype":"complex128","eps":1e-12,"execution_nufft_policy":"auto","interval_artifact_policy":"required_transport","pre_sum_mode":"off","reducer_strategy":"attempt-commit","requested_nufft_policy":"auto","scheduler_kind":"dask","source_structure_digest":"3edb0f3498250745a855d580c0bc70fd3bd4960c5e740034b4ceb805e16f4308","thread_count":1},"execution_digest":"f4cb8d8eb9624ea9a71c235ce2f47328759dcd5602243d3a94f4f295cb05149a","run_digest":"0bcc03d285b0a56edd5bad3c1b4bd296","schema":"mosaic.run_manifest","schema_version":1,"scientific_digest":"8165a8de3b4e1764343ebc070019b57298ec47c8aff9a390752664014c0c3be5"}
